<?xml version="1.0" encoding="utf-8"?>
<map xmlns:xsi="http://www.w3.org/2001/XMLSchema-instance" xsi:noNamespaceSchemaLocation="Map.xsd">
  <passages>
    <passage from="příjezdová cesta" to="u bazénu" door="false" closed="false" coordinates="1001, 1040, 1010, 1040" />
    <passage from="u bazénu" to="hala" door="true" closed="true" coordinates="1039, 1052, 1039, 1048" />
  </passages>
  <localities>
    <!--Příjezdová cesta-->
    <locality name="příjezdová cesta" coordinates="1000, 1040, 1040, 1000" type="Outdoor" defaultTerrain="Asfalt" walls="None" height="0">
      <!--Dlážděná cesta vepředu vlevo-->
      <panel terrain="Tiles" coordinates="0, 0, 24, 4" canBeOccupied="true" />
      <!--Křoví úplně nahoře-->
      <panel terrain="Bush" coordinates="11, 0, 39, 0" canBeOccupied="false" />
      <!--štěrk vlevo-->
      <panel terrain="Gravel" coordinates="0, 5, 24, 40" canBeOccupied="true" />
      <!--štěrk vpravo-->
      <panel terrain="Gravel" coordinates="35, 1, 40, 40" canBeOccupied="true" />
      <!--Dřevěný plot vlevo nahoře-->
      <object name="plot" coordinates="0, 0, 0, 5" />
      <!--Columbovo auto u brány-->
      <object name="auto" coordinates="25, 30, 27, 34" />
      <!--Elektrická brána úplně vzadu-->
      <object name="brána" coordinates="23, 40, 39, 40" />
      <!--Dřevěný plot vepředu-->
      <object name="plot" coordinates="0, 6, 21, 6" />
      <!--Dřevěný plot vlevo-->
      <object name="plot" coordinates="22, 6, 22, 40" />
      <!--Dřevěný plot vpravo-->
      <object name="plot" coordinates="40, 0, 40, 40" />
    </locality>
    <!--Bazén-->
    <locality name="u bazénu" coordinates="900, 1100, 1039, 1041" type="Outdoor" height="0" walls="Left, Front, Right" defaultTerrain="Tiles">
      <!--Díra na dveře vpravo dole-->
      <panel terrain="Tiles" coordinates="139, 48, 139, 52" canBeOccupied="true" />
      <!--hlína po celém levém okraji-->
      <panel terrain="Clay" coordinates="1, 1, 20, 58" canBeOccupied="true" />
      <!--hlína po celé horní straně-->
      <panel terrain="Clay" coordinates="21, 1, 138, 9" canBeOccupied="true" />
      <!--tráva po většině horní strany-->
      <panel terrain="Grass" coordinates="23, 2, 131, 7" canBeOccupied="true" />
      <!--křoví vlevo nahoře-->
      <panel terrain="Bush" coordinates="30, 1, 42, 2" canBeOccupied="true" />
      <!--křoví vlevo nahoře-->
      <panel terrain="Bush" coordinates="18, 1, 25, 2" canBeOccupied="true" />
      <!--křoví vlevo nahoře-->
      <panel terrain="Bush" coordinates="8, 1, 13, 2" canBeOccupied="true" />
      <!--křoví vlevo nahoře-->
      <panel terrain="Bush" coordinates="2, 1, 4, 2" canBeOccupied="true" />
      <!--trávník vlevo nahoře-->
      <panel terrain="Grass" coordinates="3, 4, 18, 12" canBeOccupied="true" />
      <!--trávník vlevo dole-->
      <panel terrain="Grass" coordinates="2, 30, 18, 57" canBeOccupied="true" />
      <!--louže nalevo od bazénu-->
      <panel terrain="Puddle" coordinates="31, 34, 33, 40" canBeOccupied="true" />
      <panel terrain="Puddle" coordinates="34, 33, 38, 38" canBeOccupied="true" />
      <panel terrain="Puddle" coordinates="36, 31, 39, 32" canBeOccupied="true" />
      <panel terrain="Puddle" coordinates="35, 32, 35, 32" canBeOccupied="true" />
      <panel terrain="Puddle" coordinates="37, 30, 39, 30" canBeOccupied="true" />
      <panel terrain="Puddle" coordinates="37, 30, 39, 30" canBeOccupied="true" />
      <panel terrain="Puddle" coordinates="38, 29, 39, 29" canBeOccupied="true" />
      <panel terrain="Puddle" coordinates="39, 28, 39, 28" canBeOccupied="true" />
      <!--betonový plácek mezi lavičkami-->
      <panel terrain="Concrete" coordinates="12, 32, 18, 38" canBeOccupied="true" />
      <!--stromy u levé zdi-->
      <object name="strom" coordinates="4, 5, 4, 5" />
      <object name="strom" coordinates="2, 34, 2, 34" />
      <object name="strom" coordinates="2, 44, 2, 44" />
      <object name="strom" coordinates="2, 57, 2, 57" />
      <object name="mrtvola" coordinates="36, 39, 36, 40" />
      <!--záhon růží vlevo nad lavičkami-->
      <object name="růže" coordinates="2, 18, 12, 24" />
      <!--gril mezi lavičkami-->
      <object name="gril" coordinates="13, 35, 15, 35" />
      <!--lavička u levé zdi-->
      <object name="lavička" coordinates="12, 39, 17, 40" />
      <!--lavička u levé zdi-->
      <object name="lavička" coordinates="12, 30, 15, 31" />
      <!--lavička u levé zdi-->
      <object name="lavička" coordinates="10, 31, 11, 40" />
      <!--hadice u levé zdi-->
      <object name="hadice" coordinates="1, 37, 1, 39" />
      <!--Telefon u bazénu-->
      <object name="telefon" coordinates="81, 30, 81, 30" />
      <!--popelnice vlevém dolním rohu-->
      <object name="popelnice" coordinates="12, 58, 12, 58" />
      <!--Odrazové prkno na kraji bazénu-->
      <object name="prkno" coordinates="39, 36, 39, 36" />
      <!--Schůdky na rohu bazénu-->
      <object name="schůdky" coordinates="39, 38, 39, 39" />
      <!--Bazén uprostřed-->
      <object name="bazén" coordinates="40, 20, 80, 40" />
      <!--Dřevěný plot na dolní straně-->
      <object name="plot" coordinates="1, 59, 100, 59" />
    </locality>
    <!--hala ve wagnerově domě-->
    <locality name="hala" type="Indoor" defaultTerrain="Carpet" height="4" walls="Front, Right, Back" coordinates="1040, 1059, 1061, 1041">
      <!--okno napravo-->
      <object name="okno" coordinates="15, 18, 20, 18" />
      <!--vitrýna s poháry napravo u zdi-->
      <object name="vitrýna" coordinates="3, 17, 10, 17" />
      <!--falešné dveře napravo od stolu-->
      <object name="dveře" coordinates="6, 0, 6, 0" />
      <!--rádio nalevo od stolu-->
      <object name="rádio" coordinates="0, 1, 0, 1" />
      <!--pracovní stůl-->
      <object name="stůl" coordinates="1, 1, 2, 2" />
      <!--kancelářská židle-->
      <object name="židle" coordinates="1, 3, 1, 3" />
      <!--telefon-->
      <object name="telefon" coordinates="3, 1, 3, 1" />
      <!--Barový pult uprostřed-->
      <object name="barový pult" coordinates="10, 3, 10, 12" />
      <!--Barová stolička uprostřed před barem-->
      <object name="barová stolička" coordinates="9, 4, 9, 4" />
      <!--Barová stolička uprostřed před barem-->
      <object name="barová stolička" coordinates="9, 6, 9, 6" />
      <!--Barová stolička uprostřed před barem-->
      <object name="barová stolička" coordinates="9, 8, 9, 8" />
      <!--Barová stolička uprostřed před barem-->
      <object name="barová stolička" coordinates="9, 10, 9, 10" />
      <!--Barová stolička uprostřed před barem-->
      <object name="barová stolička" coordinates="9, 12, 9, 12" />
      <!--Ohromná lednice s minibarem u zadní stěny-->
      <object name="lednice s minibarem" coordinates="15, 2, 16, 5" />
      <!--kávovar vzadu velde lednice-->
      <object name="kávovar" coordinates="15, 6, 15, 6" />
      <!--dřes vzadu vedle kávovaru-->
      <object name="dřes" coordinates="16, 7, 16, 7" />
      <!--Polička s nádobím vzadu vedle dřezu-->
      <object name="polička s nádobím" coordinates="16, 12, 16, 8" />
    </locality>
  </localities>
</map>